{
  "schema_version": "secure-bench-phase13-commitments-v1",
  "holdout_id": "secure-bench-phase13-holdout-v4",
  "manifest_sha256": "b6f7eedbcc5d524078965f7138eee7e3b89ddcfb318c98a7eed642fb53f33e76",
  "expectations_sha256": "9f94266a851caed513877afe4d2a59430b63707986e972fe4bdadbc0b2df9708",
  "aggregate_corpus_sha256": "03545f0f6ff5a1796815d076542770aa3334fce276cdb2906e4cc5b76f6c75a9",
  "contract_merkle_root": "853dbd66de362d9da8ecbe3d6eb262aadafd34fba2dee99d0bc5b2e284db76a6",
  "evaluator_sha256": "65bb311a4d1b726b65e703e5f34e916cb8e3bddbb01cfec146e3af83f1ce054d",
  "genesis_ledger_sha256": "fadb09649e2dba60b566096cf33aad0675e5eeb806d4501ea13a232c7af0a1ee",
  "fixture_files": {
    "prospective/phase-13-holdout-v4/fixtures/unit-001/entry.jsx": "d53afc69a0805e6171201e2f41da51eb362110ada594a9cceb30c4db33593de2",
    "prospective/phase-13-holdout-v4/fixtures/unit-002/entry.jsx": "812d7754265245f4c359325927b86c1d93fd1297c35793f1346b275a39f3039a",
    "prospective/phase-13-holdout-v4/fixtures/unit-003/entry.ts": "fe50cfb41a7f012eb24ba542f936a66b93f80bfbb03f4e1a4ab8248fcb5f82c6",
    "prospective/phase-13-holdout-v4/fixtures/unit-004/entry.ts": "7a4ddc97eba259be532f9bc6e66ba37913d7314d44421416531ad823e1b96797",
    "prospective/phase-13-holdout-v4/fixtures/unit-005/entry.js": "7b1c0581c00d96c2a487413cf188bb2ff4ee64f1da3fcd622c4d77992dde905d",
    "prospective/phase-13-holdout-v4/fixtures/unit-006/entry.js": "9673b8280bd6a738b215f6d35260e99bf7a5e76cc3789c9329b9e87e900c69af",
    "prospective/phase-13-holdout-v4/fixtures/unit-007/entry.tsx": "163caf0ac84e13ba8cd87e71d63bd38a66a74dddcbe2d6f34e109108d27da91d",
    "prospective/phase-13-holdout-v4/fixtures/unit-008/entry.tsx": "44a21fcaae23e9376f28b2e246914f2b599aa5c53183572dbecb4b0f09b5d94e",
    "prospective/phase-13-holdout-v4/fixtures/unit-009/bridge.tsx": "f39dcabb234f1f50ee554289a0d2b808728b068227b2cee7346595edd5548aca",
    "prospective/phase-13-holdout-v4/fixtures/unit-009/entry.tsx": "57b525ce467997011de25767857d35a6a8c8b8d4116310c20fe1b1078003b0dd",
    "prospective/phase-13-holdout-v4/fixtures/unit-010/bridge.tsx": "3ceb70bd95ff8449e446d87e32f69f66f371c7df4f6749217d470ef88e2434ad",
    "prospective/phase-13-holdout-v4/fixtures/unit-010/entry.tsx": "57b525ce467997011de25767857d35a6a8c8b8d4116310c20fe1b1078003b0dd",
    "prospective/phase-13-holdout-v4/fixtures/unit-011/entry.js": "47d5c94184a627f716099eaa1c9bb5feee4cf225e144778cba1866b54fd2a63d",
    "prospective/phase-13-holdout-v4/fixtures/unit-012/entry.js": "be819e9788097bb12863e738f0a9f8cbea72c8a9968380f29d7c95f0b3f60cff",
    "prospective/phase-13-holdout-v4/fixtures/unit-013/entry.jsx": "b3bf92874bd69f5324daa359afb3178616e2ce35c00844d55c828808eee455b5",
    "prospective/phase-13-holdout-v4/fixtures/unit-014/entry.jsx": "4d74973cc9a794ae1c54a05cf946a3552d1838a009d8be101fe88b1aac2349bf",
    "prospective/phase-13-holdout-v4/fixtures/unit-015/bridge.ts": "f39dcabb234f1f50ee554289a0d2b808728b068227b2cee7346595edd5548aca",
    "prospective/phase-13-holdout-v4/fixtures/unit-015/entry.ts": "ac8b062e06bc1dead19d1827d66d5bd0dbc6c0f4bf6e82c5909a33ef6ce781fe",
    "prospective/phase-13-holdout-v4/fixtures/unit-016/bridge.ts": "ea6bef6c0f84bf4e6f46477467d792fbe41ed17fd1e12e4ce930fe286f9a59bd",
    "prospective/phase-13-holdout-v4/fixtures/unit-016/entry.ts": "ac8b062e06bc1dead19d1827d66d5bd0dbc6c0f4bf6e82c5909a33ef6ce781fe",
    "prospective/phase-13-holdout-v4/fixtures/unit-017/bridge.jsx": "894191cb01736c4e303704976bde7b52f961c6ff45216480b04d6505cd382901",
    "prospective/phase-13-holdout-v4/fixtures/unit-017/entry.jsx": "dd172df146f9bbbeb3a3ec24cbedaf93838b74210a835e5001bafce63f0c48b9",
    "prospective/phase-13-holdout-v4/fixtures/unit-018/bridge.jsx": "8151807a5857cd64d26668c7a293434c2369c56f60a5c2448c35f37ac42e0ad6",
    "prospective/phase-13-holdout-v4/fixtures/unit-018/entry.jsx": "dd172df146f9bbbeb3a3ec24cbedaf93838b74210a835e5001bafce63f0c48b9",
    "prospective/phase-13-holdout-v4/fixtures/unit-019/entry.js": "528253f90e1fe6b95db0e6db5e7ccb895ed989fbe1fc1c20acafc2126c7c62eb",
    "prospective/phase-13-holdout-v4/fixtures/unit-020/entry.js": "00ae668ef3dd1ef45a2edd13c17224734650f3847f11d7dd86c49c958956f4b3",
    "prospective/phase-13-holdout-v4/fixtures/unit-021/entry.jsx": "bd4ed69aedc5256d4127f472939a85af71c7da2ff22624677d7b0d020d2943d7",
    "prospective/phase-13-holdout-v4/fixtures/unit-022/entry.jsx": "c273a143b547e8027be7f47bd5e89373f6633ac660114eeec22c5b9a8066d7b1",
    "prospective/phase-13-holdout-v4/fixtures/unit-023/entry.js": "4da5f32478ece8f3185fd2b65606d61eea5fcd8a7722b320298dc7d3545b4c28",
    "prospective/phase-13-holdout-v4/fixtures/unit-024/entry.js": "9204abb496b6b59d2676033e075efc82804284e7b847319ef9d29c87a512afec",
    "prospective/phase-13-holdout-v4/fixtures/unit-025/bridge.ts": "e509e86884ae3e15f7e4cf136c0e98d20dc38f6dfaed74c5b0755c4e46a85b2c",
    "prospective/phase-13-holdout-v4/fixtures/unit-025/entry.ts": "cf21f6de8dda10d1abbe0656ce5003372b3d5cb4f950afe04c4eda8576d2a87c",
    "prospective/phase-13-holdout-v4/fixtures/unit-026/bridge.ts": "eac7b9f1d3a7458d7ec0940f442635bd47941f0e633d86cfdd898378e42438c9",
    "prospective/phase-13-holdout-v4/fixtures/unit-026/entry.ts": "cf21f6de8dda10d1abbe0656ce5003372b3d5cb4f950afe04c4eda8576d2a87c",
    "prospective/phase-13-holdout-v4/fixtures/unit-027/entry.tsx": "89afe4bdc76c46e50d59fd7e79fe9573c79c58e7edd6640a96948ea513869ff3",
    "prospective/phase-13-holdout-v4/fixtures/unit-028/entry.tsx": "09d419f1ddd48d4f8448fd6c1213d727033ded0afc89a3d0b778abf7c1bd656a",
    "prospective/phase-13-holdout-v4/fixtures/unit-029/entry.ts": "09f6c517df01ed00ecc392fcd306008dc438d861bb5835c8cb20a6bda5b95030",
    "prospective/phase-13-holdout-v4/fixtures/unit-030/entry.ts": "cf100fecfedaeff7ff1e239f1d03edbe14aa13dcf977f08a792d565a4d6443f9",
    "prospective/phase-13-holdout-v4/fixtures/unit-031/entry.tsx": "bd7e21245c018094a6b8514feb27341a73b5b203dc774829d6206b596e029565",
    "prospective/phase-13-holdout-v4/fixtures/unit-032/entry.tsx": "7d67e2042b1ae340f83f704aa297feefe87ce36e4d4c982c9bf02de3ba2d2aa8",
    "prospective/phase-13-holdout-v4/fixtures/unit-033/entry.ts": "7cf70bfce0e8750ede4aa95024d06e813d093a48d799e93d75ee6481373ca1e9",
    "prospective/phase-13-holdout-v4/fixtures/unit-034/entry.ts": "f7bdc1dbe6b341624faee80d6e392c805cc07d1f8eebee3c2be155ead767ee09",
    "prospective/phase-13-holdout-v4/fixtures/unit-035/entry.js": "39e9f0ff66a60be46861281367631350804d999a609c8fd16d4b101953846ddc",
    "prospective/phase-13-holdout-v4/fixtures/unit-036/entry.js": "7d8edf2eaa0b55248b14cff0da7dda2856939c52a30baa18d0f3f393e2a5d21f",
    "prospective/phase-13-holdout-v4/fixtures/unit-037/entry.ts": "57404c32f0813c997aa1d4f473135e3ce86efc2a1dee2720d94afd389588aa1e",
    "prospective/phase-13-holdout-v4/fixtures/unit-038/entry.ts": "b96c09523738a4f534322d583c7e7465241d5506d0a64e7fc70dc941ae2d5c67",
    "prospective/phase-13-holdout-v4/fixtures/unit-039/entry.tsx": "370f89709db50c0a30a43cd73b5147b89d339f6034355933c0f57f4ace9da38e",
    "prospective/phase-13-holdout-v4/fixtures/unit-040/entry.tsx": "e5ea9b689d9ea3db1186b164473b7908c9daa48a672b335f70b997d0049920e0",
    "prospective/phase-13-holdout-v4/fixtures/unit-041/bridge.jsx": "006c7ba0046926d1a483eafebd0575bab76becf1fade4b686582ac0f5f82b7ae",
    "prospective/phase-13-holdout-v4/fixtures/unit-041/entry.jsx": "a7f32b80d8a86bd8e2cea684555eaebd13cfeff1c3d6a5aef0ed4bd5555043c5",
    "prospective/phase-13-holdout-v4/fixtures/unit-042/bridge.jsx": "40256d3cd111679d08aada5566185291f73b65e6b06466f0a4cd30669316b8ff",
    "prospective/phase-13-holdout-v4/fixtures/unit-042/entry.jsx": "a7f32b80d8a86bd8e2cea684555eaebd13cfeff1c3d6a5aef0ed4bd5555043c5",
    "prospective/phase-13-holdout-v4/fixtures/unit-043/entry.js": "55cea15ffe62b6a8a0d77c52f79bd99b63e1eee1598a8cdd008e17bed2608538",
    "prospective/phase-13-holdout-v4/fixtures/unit-044/entry.js": "04f052b96c41bd1f745a32beb9fc86c70281f17b4b2519b25ab47c98ce0726e8",
    "prospective/phase-13-holdout-v4/fixtures/unit-045/entry.tsx": "55157952120b4a84d09eaa1853e2cb61df4f6865c819e408acaabac4813f81fc",
    "prospective/phase-13-holdout-v4/fixtures/unit-046/entry.tsx": "e8c68eb1049d765a4bc4e01a7c007676c416cb491b7248852c04043943573600",
    "prospective/phase-13-holdout-v4/fixtures/unit-047/bridge.jsx": "006c7ba0046926d1a483eafebd0575bab76becf1fade4b686582ac0f5f82b7ae",
    "prospective/phase-13-holdout-v4/fixtures/unit-047/entry.jsx": "914a50037988485d69f85fcb08bee6ffc9be53c51297c52135079480aa0319d3",
    "prospective/phase-13-holdout-v4/fixtures/unit-048/bridge.jsx": "40256d3cd111679d08aada5566185291f73b65e6b06466f0a4cd30669316b8ff",
    "prospective/phase-13-holdout-v4/fixtures/unit-048/entry.jsx": "914a50037988485d69f85fcb08bee6ffc9be53c51297c52135079480aa0319d3",
    "prospective/phase-13-holdout-v4/fixtures/unit-049/bridge.tsx": "e8e2312ddaf5070584a130ef99127f9ee7f781069cfdca3de8cf3b08398bf9e4",
    "prospective/phase-13-holdout-v4/fixtures/unit-049/entry.tsx": "22aedcf4e39cee2933d5ddf9485215dcb07a8894890d30c103c261857c60371f",
    "prospective/phase-13-holdout-v4/fixtures/unit-050/bridge.tsx": "ef8d58784caea450c13425facd9bce6fbcb067944177933545dc4b3e5ea6f4b6",
    "prospective/phase-13-holdout-v4/fixtures/unit-050/entry.tsx": "22aedcf4e39cee2933d5ddf9485215dcb07a8894890d30c103c261857c60371f",
    "prospective/phase-13-holdout-v4/fixtures/unit-051/entry.js": "adc4b9c6618538e7b2f7d606988ca560ead6c37ce27be162534c148ddba00ddf",
    "prospective/phase-13-holdout-v4/fixtures/unit-052/entry.js": "61083df8256b18599d7a247213c2fa6fe9e7dd8cf4fe95b402307a6f2b057c15",
    "prospective/phase-13-holdout-v4/fixtures/unit-053/entry.js": "a719ae5e866806d3b7f3c6fb679308b4510a61924615f5b4af4740cb8b9d3bbf",
    "prospective/phase-13-holdout-v4/fixtures/unit-054/entry.js": "7a45e208f6340ea6820744cb15cbe01652c97aa6d31ede2b130add4b912bb2e0",
    "prospective/phase-13-holdout-v4/fixtures/unit-055/entry.jsx": "a349146535fd7a30f1d1478e67ed8c3cecc9627b58c1b5942edeb6558a8bb69c",